<?xml version="1.0" encoding="UTF-8"?>
<agentConfig xmlns="http://geni-orca.renci.org/xml/node-agent2/AgentConfig"
	xmlns:xsi="http://www.w3.org/2001/XMLSchema-instance"
	xsi:schemaLocation="http://geni-orca.renci.org/xml/node-agent2/AgentConfig http://geni-orca.renci.org/xml/node-agent2/AgentConfig.xsd"
	password="pass">

	<tick length="1" unit="minute"/>
	<plugins>
		<plugin name="null-plugin">
			<jar>/opt/nodeagent2/plugins/na2-null-plugin.jar</jar>
			<mainClass>org.renci.nodeagent2.null_agent.Main</mainClass>
			<schedulePeriod length="3" unit="minute" />
			<renewAdvanceTicks>2</renewAdvanceTicks>
			<description>Null plugin for testing</description>
			<properties>
				<property name="pr" value="val" />
				<property name="pr1" value="val1" />
			</properties>
		</plugin>
		<!--
		<plugin name="oscars">
			<jar>/opt/nodeagent2/plugins/na2-oscars-plugin.jar</jar>
			<mainClass>org.renci.nodeagent2.oscarslib.Main</mainClass>
			<schedulePeriod length="6" unit="minute" />
			<renewAdvanceTicks>2</renewAdvanceTicks>
			<properties>
				<property name="oscars.keystore" value="/some/path/to/jks" />
				<property name="oscars.truststore" value="/some/path/to/jks" />
				<property name="oscars.alias" value="some-alias" />
				<property name="oscars.password" value="some-password" />
				<property name="oscars.description" value="ORCA-NA2-circuit" />
			</properties>
		</plugin>
		-->
                <!--
		<plugin name="execplug" >
			<jar>/opt/nodeagent2/plugins/na2-exec-plugin.jar</jar>
			<mainClass>org.renci.nodeagent2.exec.Main</mainClass>
			<schedulePeriod length="3" unit="minute" />
			<properties>
				<property name="exec.join" value="/some/path/to/join.sh" />
				<property name="exec.leave" value="/some/path/to/leave.sh" />
				<property name="exec.modify" value="/some/path/to/modify.sh" />
				<property name="exec.renew" value="/some/path/to/renew.sh" />
				<property name="exec.status" value="/some/path/to/status.sh" />
			</properties>
		</plugin>
		-->
	</plugins>
</agentConfig>
