<?xml version="1.0" encoding="UTF-8"?>
<agentConfig xmlns="http://geni-orca.renci.org/xml/node-agent2/AgentConfig"
	xmlns:xsi="http://www.w3.org/2001/XMLSchema-instance"
	xsi:schemaLocation="http://geni-orca.renci.org/xml/node-agent2/AgentConfig http://geni-orca.renci.org/xml/node-agent2/AgentConfig.xsd"
	password="pass">

	<tick length="10" unit="second"/>
	<plugins>
		<plugin name="Null-Test-Plugin">
			<jar>/Users/ibaldin/workspace-nodeagent2/node-agent2/null-agent/target/null-agent-0.1-SNAPSHOT-jar-with-dependencies.jar</jar>
			<mainClass>orca.nodeagent2.null_agent.Main</mainClass>
			<schedulePeriod length="3" unit="minute" />
			<renewAdvanceTicks>2</renewAdvanceTicks>
			<description>Null plugin for testing</description>
			<properties>
				<property name="pr" value="val" />
				<property name="pr1" value="val1" />
			</properties>
		</plugin>
		<plugin name="Some-Test-Plugin">
			<jar>/Users/ibaldin/workspace-nodeagent2/node-agent2/null-agent/target/null-agent-0.1-SNAPSHOT.jar</jar>
			<mainClass>orca.nodeagent2.null_agent.Main</mainClass>
			<schedulePeriod length="60" unit="second" />
			<properties>
				<property name="pr" value="val" />
				<property name="pr1" value="val1" />
			</properties>
		</plugin>
	</plugins>
</agentConfig>
